<?xml version="1.0" encoding="UTF-8"?>
<persons xmlns:xsi="http://www.w3.org/2001/XMLSchema-instance"
    xsi:noNamespaceSchemaLocation="./person.xsd">
    <person>
        <names>
            <firstName>Tandi</firstName>
            <otherName>Susan</otherName>
            <otherName>Zama</otherName>
            <surname>Khumalo</surname>
        </names>
        <contactDetails>
            <businessTel>011 656 7777</businessTel>
            <businessEmail>tandi@business.co.za</businessEmail>
            <privateTelNo>01341 655 4</privateTelNo>
            <privateEmail>tandi@home.net</privateEmail>
        </contactDetails>
    </person>

    <person>
        <names>
            <firstName>Piet</firstName>
            <surname>Naidoo</surname>
        </names>
        <contactDetails>
            <businessTel>022 222 2222</businessTel>
            <businessEmail>piet@job.co.za</businessEmail>
            <privateTelNo>033 333 3333</privateTelNo>
            <privateEmail>piet@home.net</privateEmail>
        </contactDetails>
    </person>
    
</persons>
